{
  "$schema": "./packages/scaffold-registry/schema.json",
  "version": "1.0.0",
  "updatedAt": "2026-09-12T10:44:00Z",
  "project": "process-forge",
  "organization": "omeaga1",
  "policy": {
    "zeroUntrackedTodo": true,
    "requireExplicitRemovalCondition": true,
    "blockOnExpiredMilestone": true
  },
  "scaffolds": []
}
